tconst,name,year,rating,rating_count,story_line,genres,country,language,budget,gross,runtime,director,stars
tt1231277,S. Darko,2009.0,3.6,"13,184","July, 1995, the time is out of joint. Two teen girls, Sam and Corey, have left Virginia for L.A. to start over. Sam's brother has died and her family's shattered; Corey's too wild. They have car trouble in a small desert town, where Corey immediately starts her partying ways, where a meteorite strikes a windmill, and where a burned-out Desert Storm vet predicts the end of the world in four days. Sam hallucinates while sleepwalking, young men have disappeared from town, and cars come out of nowhere to cause accidents. Time travel may be possible, but it takes courage and resolve. Is the addled war veteran right? If he is, can Corey or Sam make things right?","Drama,Mystery,Sci-Fi",USA,English,"$4,000,000","$1,079,949",1h 43min,Chris Fisher,"Briana Evigan,Daveigh Chase,James Lafferty"
tt5540194,Interlude in Prague,2017.0,6.1,429,"Prague, 1786. Wolfgang Amadeus Mozart spends a few turbulent months escaping the frustrating, privileged elite of Vienna. However his unconventional presence soon unleashes a series of dramatic and tragic events. Overwhelmed by the tangled web of violence and intrigue that surrounds him and with his mind affected, Mozart creates the astonishing music and drama that becomes 'Don Giovanni'.","Drama,History,Music","Czech Republic,UK","English,Italian,Latin","GBP5,000,000","$14,699",1h 43min,John Stephenson,"Adrian Edmondson,Ian Bonar,Morfydd Clark"
tt2290739,Where the Devil Hides,2014.0,4.9,"3,641","When young girls start to go missing within a religious cult, older followers fear a long-told prophecy while the younger members suspect abusive elders are killing them off.","Horror,Thriller",USA,English,"$7,000,000","$1,428,494",1h 26min,Christian E. Christiansen,"Adelaide Kane,Alycia Debnam-Carey,Rufus Sewell"
tt1024839,De Taali,2008.0,4.0,788,"Paglu, Amu & Abhi live the lives of each other. They drink, eat & sleep together. Amu is a girl amongst the two guys, though Paglu & Abhi don't treat her like one. Paglu is the one who makes her realize about her feelings and helps her get her love. And Abhi is the rich, kind and classy guy who falls in love every time he meets a weird girl. Life however takes a serious fun turn when one of them falls in love with the other. And the one is sadly in love with some one else all together.","Comedy,Drama,Romance",India,Hindi,"INR80,000,000","$2,818,022",2h 20min,Eeshwar Nivas,"Aftab Shivdasani,Ayesha Takia,Riteish Deshmukh"
tt0117723,Spy Hard,1996.0,5.4,"35,817","General Rancor is threatening to destroy the world with a missile he is hiding at his secret base. But to complete his goal, he needs a special computer chip, invented by the scientist Prof. Ukrinsky. Special Agent Dick Steele is assigned to the case, in order to prevent the worst. He teams up with Ukrinsky's daughter Veronique, who happens to be a KGB agent.","Action,Comedy",USA,"English,French,Spanish","$18,000,000","$26,960,191",1h 21min,Rick Friedberg,"Charles Durning,Leslie Nielsen,Nicollette Sheridan"
tt0427944,Thank You for Smoking,2005.0,7.6,"212,174","The chief spokesperson and lobbyist Nick Naylor is the Vice President of the Academy of Tobacco Studies. He is talented in speaking and spins arguments to defend the cigarette industry in the most difficult situations. His best friends are Polly Bailey that works in the Moderation Council in alcohol business, and Bobby Jay Bliss of the gun business own advisory group SAFETY. They frequently meet each other in a bar and they self-title the M.O.D. Squad, a.k.a. Merchants of Death, disputing which industry has killed more people. Nick's greatest enemy is Vermont's Senator Ortolan Finistirre, who defends in the Senate the use of a skull and crossbones on cigarette packs. Nick's son Joey Naylor lives with his mother, and has the chance to know his father in a business trip. When the ambitious reporter Heather Holloway betrays Nick disclosing confidences he had in bed with her, his life turns upside-down. But Nick is good in what he does for the mortgage.","Comedy,Drama",USA,English,"$6,500,000","$39,323,027",1h 32min,Jason Reitman,"Aaron Eckhart,Cameron Bright,Maria Bello"
tt1841930,Vorrei averti qui,2010.0,2.5,13,"The true story of Samy, a girl of eighteen years and the problems with alcohol, the family, friends and love.",Drama,Italy,Italian,EUR500,"$1,469",1h 32min,Angelo Antonucci,"Angelo Antonucci,Benedetta Cimatti,Katia Oliveto Bellucci"
tt3881026,Rendel,2017.0,4.6,"1,757","The Rendel movie is a story of a man blinded by his desire for revenge and hatred. Even though Rendel can be considered as a super hero, he is somewhat darker than the traditional representatives of the genre. The movie takes place in the fictionalized version of a Finnish city, Mikkeli.","Action,Crime,Drama",Finland,"English,Finnish","EUR1,450,000","$111,795",1h 45min,Jesse Haaja,"Kristofer Gummerus,Rami Rusinen,Renne Korppila"
tt0420609,Infamous,2006.0,7.0,"16,226","On November 16, 1959, Truman Capote reads about the murder of a the Clutter family. There's no suspects. With Harper Lee, he visits the town: he wants to write about their response. First he must get locals to talk, then, he must gain access to the prisoners. One talks constantly; the other, Perry Smith, says little. Capote's implacable, believing this book will establish a new form of reportage: he must figure out what Perry wants. Their relationship becomes something more than writer and character: Perry killed in cold blood, the state will execute him in cold blood; does Capote get his story through cold calculation, or is there a price for him to pay?","Biography,Crime,Drama",USA,English,"$13,000,000","$2,689,799",1h 50min,Douglas McGrath,"Daniel Craig,Sandra Bullock,Toby Jones"
tt1666318,La demora,2012.0,7.2,366,"A middle-aged, single mother of three cares for her eighty year old father, and they are pushed to the breaking point.",Drama,"France,Mexico,Uruguay",Spanish,"$1,400,000","$11,122",1h 24min,Rodrigo Plá,"Fernando Amaral,Jorge Temponi,Néstor Guzzini"
tt0396912,Una de zombis,2003.0,4.5,486,"Two former Catholic school classmates want to be movie makers despite their total lack of talent, contacts, or even a story to tell.","Action,Comedy,Crime",Spain,Spanish,"ESP200,000,000","$1,399,096",1h 39min,Miguel Ángel Lamata,"Mayte Navales,Miguel Ángel Aijón,Miguel Ángel Aparicio"
tt0377744,A Day Without a Mexican,2004.0,4.7,"3,028","A thick fog surrounds California's borders, communication beyond state lines is cut off, and the Mexicans disappear: workers, spouses, and business owners are missing. Cars are abandoned in the street, food is left cooking on the stove. We meet the wife of a musician who's gone, a state Senator whose maid doesn't show up for work, and a farm owner whose produce is ripe and unpicked. A scientist asks any Mexicans who haven't disappeared to volunteer for genetic experiments: a female newscaster and the daughter of the musician may be the only missing links around. Why them? And where have all the Mexicans gone? Even the border guards grieve. The state and its economy grind to a halt.","Comedy,Drama,Fantasy","Mexico,Spain,USA","English,Spanish","$1,500,000","$10,057,021",1h 40min,Sergio Arau,"Caroline Aaron,Melinda Allen,Tony Abatemarco"
tt4566320,Soren,2018.0,4.8,23,Exploration of love and relationships in contempòrary Bolivia.,"Drama,Romance","Bolivia,France,Mexico","English,French,Spanish","$677,000","$19,366",1h 48min,Juan Carlos Valdivia,"Alejandra Lanza,Romel Vargas,Willy Cartier"
tt3552638,Perez.,2014.0,5.8,665,A lawyer has to cross the edge between law and crime to protect his family.,"Crime,Drama,Thriller",Italy,Italian,EUR1,"$991,494",1h 34min,Edoardo De Angelis,"Luca Zingaretti,Marco D'Amore,Simona Tabasco"
tt1126618,Morning Glory,2010.0,6.5,"73,516","Becky (Rachel McAdams) is a hard-working morning TV show producer, or at least she was until she got fired. Desperate to get a job, she finally gets an interview with Jerry (Jeff Goldblum) - who is desperate to hire a producer for the struggling show ""Daybreak"". Becky accepts the job and it proves to be more difficult than even she might be able to handle. She has to fire the sexist co-host, then try to convince egotistical news reporter, Mike Pomeroy (Harrison Ford), to take the job, and then try and get him to actually do the job, properly. And she has to do this while falling for handsome Adam (Patrick Wilson), and trying to save the show from plummeting ratings. Will Becky be able to hold on to her dream job and her sanity?","Comedy,Drama,Romance",USA,"English,Ukrainian","$40,000,000","$60,040,976",1h 47min,Roger Michell,"Diane Keaton,Harrison Ford,Rachel McAdams"
tt0089469,Legend,1985.0,6.5,"59,429",A demon who seeks to create eternal night by destroying the last of the unicorns and marrying a fairy Princess is opposed by the forest boy Jack (Tom Cruise) and his elven allies in this magical fantasy. Two different versions of this movie feature soundtracks by either Tangerine Dream or Jerry Goldsmith.,"Adventure,Fantasy,Romance","UK,USA","English,Italian","$24,500,000","$15,502,112",1h 34min,Ridley Scott,"Mia Sara,Tim Curry,Tom Cruise"
tt2909116,Le dernier loup,2015.0,6.7,"5,502","In 1967, a young Beijing student, Chen Zhen, is sent to live among the nomadic herdsmen of Inner Mongolia. Caught between the advance of civilization from the south and the nomads' traditional enemies - the marauding wolves - to the north; humans and animals, residents and invaders alike, struggle to find their true place in the world.","Adventure,Drama","China,France","Mandarin,Mongolian","$38,000,000","$125,837,070",2h 1min,Jean-Jacques Annaud,"Ankhnyam Ragchaa,Shaofeng Feng,Shawn Dou"
tt0373908,The Honeymooners,2005.0,3.3,"6,989","New York City bus driver Ralph Kramden and his feisty wife Alice, struggle to make ends meet. Despite Ralph's many get-rich-quick schemes/motivational speaker tape series, they've managed to save some money and, along with their best friends Ed and Trixie Norton, they seem to have almost enough money for a down payment on a Brooklyn duplex. However, when Ralph decides to try to impress Alice by making up what he's lost and augmenting their savings with another of his crazy schemes, he winds up losing all their money and his marriage to boot--and it takes all his determination and love for Alice to get things on track again.","Comedy,Family,Romance","Germany,USA",English,"$25,000,000","$13,183,426",1h 30min,John Schultz,"Cedric the Entertainer,Gabrielle Union,Mike Epps"
tt0289229,Hukkle,2002.0,7.1,"3,507","Using almost no dialogue, the film follows a number of residents (both human and animal) of a small rural community in Hungary - an old man with hiccups, a shepherdess and her sheep, an old woman who may or may not be up to no good, some folk-singers at a wedding, etc. While most of the film is a series of vignettes, there is a sinister and often barely perceptible subplot involving murder.","Crime,Drama,Mystery",Hungary,"Czech,Hungarian","$100,000","$132,745",1h 18min,György Pálfi,"Ferenc Bandi,József Farkas,Józsefné Rácz"
tt1444324,Perpetuum Mobile,2008.0,5.7,6,"Ron has lost his job and watched his family fall apart. He spends his days at the club of his childhood friend, Adi, where he plays cards for money. It is springtime. He meets Dina, an old friend of Adi. They quickly become close, start playing as a team, and move in together. One evening, Ron loses all his money at the tables, gets drunk and is thrown out by Adi's bodyguards. Dina takes advantage of the turmoil to steal from Adi. She convinces Ron to skip town. The two hide out in a fishing village. It is autumn. Ron and Dina discover that they know nothing about each another. They are strangers who can't so much as look into each other's eyes much less tell each other the truth.",Drama,Lithuania,Lithuanian,"EUR600,000","$5,311",1h 30min,Valdas Navasaitis,"Dainius Gavenonis,Julija Goyd,Ramunas Cicenas"
tt0191133,The Fighting Temptations,2003.0,5.6,"6,751","A New York advertising executive who is about to land a big account, has his life shaken up when it becomes known that he has lied about having a college degree. After being fired, his life is further shaken by his debtors who had counted on paying after landing the account. Having to go on the run, he is called back to his southern town roots, when his great aunt dies. At the reading of the will, he learns he has been asked to assume the mantle of choir director of his great aunt's church and if he can get the choir in the Gospel Explosion in Atlanta, he will inherit stock worth $150,000. Unfortunately the choir leaves a lot to be desired and he has to start recruiting. Among others, he gets three prisoners to join. More importantly, he gets a ""sinner"" from one of the local night clubs to join. While initially scorned and resisted, nonetheless her voice wins everyone but the hardcore church busybody.","Comedy,Drama,Music",USA,English,"$30,000,000","$33,972,062",2h 3min,Jonathan Lynn,"Beyoncé,Cuba Gooding Jr.,Mike Epps"
tt3364242,Acasã la tata,2015.0,6.5,509,"Robert, a published poet and journalist from Bucharest, goes back home, to the village where he was born, which he hasn't visited since his mother's death. His relationship with his father is not a very good one, and the reconnection is not helped by the fact that the old man now lives with Iuliana. Over the next 24 hours, Robert will confront his past, in an outstanding effort to renegotiate his present. It is a war of readjustments: expectations, status and ambitions will be discussed in search of a certain existential clarity.","Comedy,Drama",Romania,Romanian,"RON268,887","$7,911",1h 31min,Andrei Cohn,"Alexandru Papadopol,Andi Vasluianu,Ioana Flora"
tt0110857,Police Academy: Mission to Moscow,1994.0,3.6,"31,647","Dreaming of infiltrating into the globe's top-notch security systems for world domination, the rampant Russian Mafia boss, Konstantine Konali, has made a fortune promoting his best-selling computer game. In despair, Commandant Rakov calls in Commandant Eric Lassard to lend a hand in stopping the megalomaniac, and before long, the experienced team of Police Academy (1984) flies to cold Moscow, a few years after their success in Police Academy 6: City Under Siege (1989). Now, the stage seems set for the ultimate confrontation, old-school style. Can Lassard's veterans pull off a surprise victory in their challenging mission to Moscow?","Comedy,Crime",USA,English,"$6,200,000","$126,247",1h 23min,Alan Metter,"G.W. Bailey,George Gaynes,Michael Winslow"
tt0120917,The Emperor's New Groove,2000.0,7.4,"178,413","In this animated comedy from the folks at Disney, the vain and cocky Emperor Kuzco (David Spade) is a very busy man. Besides maintaining his ""groove"", and firing his suspicious administrator, Yzma (Eartha Kitt), he's also planning to build a new waterpark just for himself for his birthday. However, this means destroying one of the villages in his kingdom. Meanwhile, Yzma is hatching a plan to get revenge and usurp the throne. But, in a botched assassination courtesy of Yzma's right-hand man, Kronk (Patrick Warburton), Kuzco is magically transformed into a llama. Now, Kuzco finds himself the property of Pacha, a lowly llama herder whose home is ground zero for the water park. Upon discovering the llama's true self, Pacha offers to help resolve the Emperor's problem and regain his throne, only if he promises to move his water park.","Adventure,Animation,Comedy",USA,English,"$100,000,000","$169,327,687",1h 18min,Mark Dindal,"David Spade,Eartha Kitt,John Goodman"
tt0095853,Permanent Record,1988.0,6.4,"1,879","David Sinclair seems to have everything going for him: he's smart, musically talented, and very successful. To top off his senior year in high school, his band is trying to get a recording session. Therefore, David's suicide leaves everyone, especially his best friend and band-mate, Chris, with a lot of questions.","Drama,Music,Romance",USA,English,"$8,000,000","$1,893,139",1h 31min,Marisa Silver,"Alan Boyce,Keanu Reeves,Pamela Gidley"
tt2691498,Hoe duur was de suiker,2013.0,6.8,"1,521","The Price Of Sugar tells the alternately gripping, romantic and heart-wrenching story of Sarith and Mini-Mini as they grow up on the sugar plantations of Suriname in the latter half of the eighteenth century. Where Sarith is the most beautiful woman in the colony, the mulatto Mini-Mini is forever in her shadow, slave to her own half-sister.","Drama,History","Germany,Netherlands,South Africa",Dutch,"EUR6,011,348","$1,625,240",2h,Jean van de Velde,"Gaite Jansen,Neil Sandilands,Werner Kolf"
tt1519461,Area 51,2015.0,4.2,"13,120","Obsessed with breaking into the U.S. Air Force highly classified facility known only as Area 51, three young friends and zealous conspiracy theorists--Reid, Darrin and Ben--travel to Las Vegas. Equipped with state-of-the-art gear, they team up with Jelena, the daughter of the secret installation's former employee, and summon up the courage to sneak into the facility, intent on unearthing its otherworldly mysteries. There, in the bowels of the heavily guarded compound, terrifying truths and unfathomable knowledge await, and only the audacious UFO investigators' raw footage can prove their existence. However, can they make it back in one piece to share it with the world?","Horror,Mystery,Sci-Fi",USA,English,"$5,000,000","$7,556",1h 31min,Oren Peli,"Ben Rovner,Darrin Bragg,Reid Warner"
tt2194499,About Time,2013.0,7.8,"297,505","At the age of 21, Tim Lake (Domhnall Gleeson) discovers he can travel in time... The night after another unsatisfactory New Year party, Tim's father (Bill Nighy) tells his son that the men in his family have always had the ability to travel through time. Tim can't change history, but he can change what happens and has happened in his own life-so he decides to make his world a better place...by getting a girlfriend. Sadly, that turns out not to be as easy as you might think. Moving from the Cornwall coast to London to train as a lawyer, Tim finally meets the beautiful but insecure Mary (Rachel McAdams). They fall in love, then an unfortunate time-travel incident means he's never met her at all. So they meet for the first time again-and again-but finally, after a lot of cunning time-traveling, he wins her heart. Tim then uses his power to create the perfect romantic proposal, to save his wedding from the worst best-man speeches, to save his best friend from professional disaster and to ...","Comedy,Drama,Fantasy",UK,English,"$12,000,000","$87,100,449",2h 3min,Richard Curtis,"Bill Nighy,Domhnall Gleeson,Rachel McAdams"
tt3697946,Napapiirin sankarit 2,2015.0,6.0,"1,620","It's been three years since we last met Janne and Inari. Since then, they've had a daughter named Lumi. Janne and his friends experience a new adventure, this time on an autumn night. The boys go to a party but end up chasing Lumi who has disappeared. Meanwhile, Inari enjoys a girls-night-out and has an adventure of her own.",Comedy,Finland,Finnish,"EUR1,600,000","$4,791,063",1h 27min,Teppo Airaksinen,"Jussi Vatanen,Pamela Tola,Timo Lavikainen"
tt1231583,Due Date,2010.0,6.5,"322,289","Businessman and first time father (to-be), Peter Highman's in Atalanta trying to get home to LA, where how wife's about to give birth, but after getting kicked off a plane, due to his seat mate, the pair end up trying to hitch a ride to the west coast.","Comedy,Drama",USA,"English,Spanish","$65,000,000","$211,780,824",1h 35min,Todd Phillips,"Michelle Monaghan,Robert Downey Jr.,Zach Galifianakis"
tt3685818,Viikossa aikuiseksi,2015.0,5.4,395,"Adult Camp is a comedy about the bumpy road to personal growth. A group of men and women, strangers to each other, choose to spend a different kind of summer holiday week by traveling to the beautiful Turku archipelago to participate in an inviting, upgraded version of an adult camp. When they discover that the galloping horses from the camp's sales video are just symbols of a free mind, and the guru of the camp takes off to witness his dog in labour, the participants are forced to examine themselves and each other to find the necessary elements for growth. Perhaps the camp doesn't fulfill its promise of the ""most wonderful week of your life"", but one thing's for sure - no one returns home the same.",Comedy,Finland,Finnish,"EUR1,500,000","$1,140,091",1h 30min,Johanna Vuoksenmaa,"Eppu Salminen,Minttu Mustakallio,Taneli Mäkelä"
tt0469623,Things We Lost in the Fire,2007.0,7.2,"27,563","Grief, recovery, and human contact. Brian is a great guy - a sweet father, a good husband, and a loyal friend to his boyhood pal Jerry who's a junkie. When tragedy strikes, Jerry tries to help Brian's wife and children cope, and Audrey, Brian's widow, tries to help Jerry kick the habit. Loss and addiction are stubborn. The story starts on the day of the funeral, with Brian appearing in flashbacks. A neighbor's divorce, a dinner party that includes a young woman from the Narcotics Anonymous group Jerry attends, and thinking back to a fire in Brian and Audrey's garage give the story texture.",Drama,"Canada,UK,USA",English,"$16,000,000","$8,591,255",1h 58min,Susanne Bier,"Alison Lohman,Benicio Del Toro,Halle Berry"
tt0077288,La cage aux folles,1978.0,7.3,"9,782",Two gay men living in St. Tropez have their lives turned upside down when the son of one of the men announces he is getting married. They try to conceal their lifestyle and their ownership of the drag club downstairs when the fiancée and her parents come for dinner.,Comedy,"France,Italy",French,"FRF7,000,000","$20,424,259",1h 37min,Édouard Molinaro,"Claire Maurier,Michel Serrault,Ugo Tognazzi"
tt0079944,Stalker,1979.0,8.2,"115,202","In a small, unnamed country there is an area called the Zone. It is apparently inhabited by aliens and contains the Room, where in it is believed wishes are granted. The government has declared The Zone a no-go area and have sealed off the area with barbed wire and border guards. However, this has not stopped people from attempting to enter the Zone. We follow one such party, made up of a writer, who wants to use the experience as inspiration for his writing, and a professor, who wants to research the Zone for scientific purposes. Their guide is a man to whom the Zone is everything, the Stalker.","Drama,Sci-Fi",Soviet Union,Russian,"RUR6,000,000","$303,815",2h 42min,Andrei Tarkovsky,"Aleksandr Kaydanovskiy,Alisa Freyndlikh,Anatoliy Solonitsyn"
tt10682318,Ander Mens,2018.0,5.2,72,"A side-splitting action comedy, with a series of unfortunate events happening to a very unfortunate and mediocre man. Daniel Niemand is the kind of dumpy little sad-sack that even flies wouldn't care to buzz around. And that's on a good day. But all that's about to change after his wife leaves him for their marriage counsellor and he unknowingly becomes integral in a high-level police ploy to capture a local crime syndicate. Welcome to the worst week in Daniel Niemand's life.",Comedy,South Africa,"Afrikaans,English","$25,000,000","$8,462",1h 39min,Quentin Krog,"Bennie Fourie,James Borthwick,Marlee van der Merwe"
tt2196488,Atlantic.,2014.0,6.5,486,A Moroccan fisherman sets off on an epic journey towards Europe on his wind surfboard. But the pursuit of dreams does not come without sacrifice.,Drama,"Belgium,France,Germany,Morocco,Netherlands","Arabic,English,French","EUR1,800,000","$14,484",1h 34min,Jan-Willem van Ewijk,"Fettah Lamara,Mohamed Majd,Thekla Reuten"
tt6817944,Om det oändliga,2019.0,6.9,"3,008","ABOUT ENDLESSNESS is a reflection on human life in all its beauty and cruelty, its splendor and banality. We wander, dreamlike, gently guided by our Scheherazade-esque narrator. Inconsequential moments take on the same significance as historical events: a couple floats over a war-torn Cologne; on the way to a birthday party, a father stops to tie his daughter's shoelaces in the pouring rain; teenage girls dance outside a cafe; a defeated army marches to a prisoner-of-war camp. Simultaneously an ode and a lament, ABOUT ENDLESSNESS presents a kaleidoscope of all that is eternally human, an infinite story of the vulnerability of existence.","Drama,Fantasy","France,Germany,Norway,Sweden",Swedish,"EUR4,558,000","$323,090",1h 18min,Roy Andersson,"Anja Broms,Bengt Bergius,Marie Burman"
tt0056937,Cleopatra,1963.0,7.0,"29,122","In 48 B.C., Julius Caesar (Sir Rex Harrison) pursues Pompey from Pharsalia to Egypt. Pharaoh Ptolemy XIII (Richard O'Sullivan), now supreme ruler after deposing his older sister, Cleopatra VII (Dame Elizabeth Taylor), attempts to gain favor with Caesar by presenting the conquerer with the head of Pompey, borne by his governors, Pothinus (Grégoire Aslan) and Achillas (John Doucette). To win Caesar's support from her brother, Cleopatra hides herself in a rug, which Apollodorus (Cesare Danova), her servant, presents to Caesar. The Roman is immediately infatuated. Banishing Ptolemy, he declares Cleopatra Egypt's sole ruler and takes her as his mistress. A son, Caesarion (Loris Loddi), is born of their union. Caesar, however, must return to Italy. Although he is briefly reunited with Cleopatra during a magnificent reception for the Queen in Rome, Caesar is assassinated shortly thereafter, and Cleopatra returns to Egypt. When Mark Antony (Richard Burton), Caesar's protégé, beholds Cleopatra...","Biography,Drama,History","Switzerland,UK,USA",English,"$44,000,000","$57,777,778",3h 12min,Joseph L. Mankiewicz,"Elizabeth Taylor,Rex Harrison,Richard Burton"
