tconst,name,year,rating,rating_count,story_line,genres,country,language,budget,gross,runtime,director,stars
tt0086510,Under Fire,1983.0,7.0,"6,841","Nicaragua 1979: Star photographer Russel Price covers the civil war against president Somoza. Facing the cruel fighting - people versus army - it's often hard for him to stay neutral. When the Guerillas have him take a picture of the leader Rafael, who's believed to be dead, he gets drawn into the happenings. Together with his reporter friends Claire and Alex he has to hide from the army.","Drama,War","Mexico,USA",English,"$9,500,000","$5,696,391",2h 8min,Roger Spottiswoode,"Ed Harris,Gene Hackman,Nick Nolte"
tt0424272,Melancholian 3 huonetta,2004.0,7.2,630,"A searing examination of the unrelenting Chechen conflict, observed through the prisms of a Russian military boys academy, a war-torn town and a children's refugee camp.","Documentary,War","Denmark,Finland,Germany,Sweden","Arabic,Chechen,Russian","EUR560,400","$19,317",1h 46min,Pirjo Honkasalo,Pirkko Saisio
tt3037336,Sedmero krkavcu,2015.0,7.3,324,"A classic fairy tale movie based on a story ""Sedmero krkavcu"" from famous Czech writer Bozena Nemcova. A young girl takes a hard task. She must try to save her brothers and get rid of the curse placed on them by their mother. It is a story of courage, perseverance, but also of the power of words, truth and true love ... The main character is a young girl Bohdanka who is born into troubled family of baker whose wife years ago in a fit of rage cursed seven of their sons and they became ravens. Parents kept this as a secret from Bohdanka for many years. However, when Bohdanka at her adulthood learns about the curse of her family, she decides to save her brothers. She gets advice from the local witch that she must sew special shirts for her brothers. She must alone without help of others pick nettles, process fibers, weave cloth and sew each stich. Bohdanka embarks on a long journey to rescue her brothers...","Adventure,Comedy,Family","Czech Republic,Slovakia","Czech,Slovak","CZK48,000,000","$478,725",1h 43min,Alice Nellis,"Lukás Príkazský,Martha Issová,Sabina Remundová"
tt0819895,Hîrtia va fi albastrã,2006.0,7.7,"1,995","Out of enthusiasm, a Militia soldier abandons his platoon and decides to fight for the cause of the Revolution. His Lieutenant and the rest of the crew look for him during the confused night of 22-23 December 1989.","Action,Drama",Romania,Romanian,"EUR700,000","$17,419",1h 35min,Radu Muntean,"Adi Carauleanu,Dragos Bucur,Paul Ipate"
tt2476186,A Memória que me Contam,2012.0,6.1,226,"A group of friends who resisted Brazilian dictatorship face, along with their sons, the conflicts between past and present as one of theirs is passing away.",Drama,"Argentina,Brazil,Chile","French,Italian,Portuguese","BRL1,000","$26,573",1h 35min,Lúcia Murat,"Clarisse Abujamra,Eduardo Cravo,Otávio Augusto"
tt0082533,The Howling,1981.0,6.6,"30,985","In a red light district, newswoman Karen White is bugged by the police, investigating serial killer Eddie Quist, who has been molesting her through phone calls. After police officers find them in a peep-show cabin and shoot Eddie, Karen becomes emotionally disturbed and loses her memory. Hoping to conquer her inner demons, she heads for the Colony, a secluded retreat where the creepy residents are rather too eager to make her feel at home. There also seems to be a bizarre connection between Eddie Quist and this supposedly safe haven. And when, after nights of being tormented by unearthly cries, Karen ventures into the forest and makes a terrifying discovery.",Horror,USA,"English,Spanish","$1,000,000","$17,985,893",1h 31min,Joe Dante,"Dee Wallace,Dennis Dugan,Patrick Macnee"
tt1981703,The Harvest/La Cosecha,2011.0,7.1,63,The story of the children who work 12-14 hour days in the fields without the protection of child labor laws. These children are not toiling in the fields in some far away land. They are working in America.,Documentary,USA,"English,Spanish","$560,000","$3,709",1h 20min,U. Roberto Romano,Perla Sanchez
tt2371365,La Vingança,2016.0,6.5,247,"Two friends hit the road to Buenos Aires aboard an orange Opala 72, with a mission: be with as many women as possible. This is all a plan to wash the honor of ""Caco"", a man who found his girlfriend in bed with an Argentine.",Comedy,"Argentina,Brazil","Portuguese,Spanish",BRL5,"$34,048",1h 30min,Fernando Fraiha,"Daniel Furlan,Felipe Rocha,Leandra Leal"
tt0090774,Brighton Beach Memoirs,1986.0,6.8,"3,243","Eugene, a young teenage Jewish boy, recalls his memoirs of his time as an adolescent youth. He lives with his parents, his aunt, two cousins, and his brother, Stanley, whom he looks up to and admires. He goes through the hardships of puberty, sexual fantasy, and living the life of a poor boy in a crowded house.",Comedy,USA,English,"$18,000,000","$11,957,943",1h 48min,Gene Saks,"Blythe Danner,Jonathan Silverman,Stacey Glick"
tt2023690,Sightseers,2012.0,6.5,"26,635","Chris wants to show girlfriend Tina his world, but events soon conspire against the couple and their dream caravan holiday takes a very wrong turn.","Adventure,Comedy,Crime",UK,English,"GBP1,300,000","$2,122,909",1h 28min,Ben Wheatley,"Alice Lowe,Kenneth Hadley,Steve Oram"
tt0095560,Mac and Me,1988.0,3.4,"11,404",An alien trying to escape from NASA is befriended by a wheelchair-bound boy.,"Adventure,Family,Fantasy",USA,English,"$13,000,000","$6,424,112",1h 35min,Stewart Raffill,"Christine Ebersole,Jonathan Ward,Tina Caspary"
tt4811564,Las furias,2016.0,5.9,275,"Marga, a 65 years-old woman, decides to sale the family country house in order to get the money to retire and travel with Julia, her young girlfriend. Noticing it to the family, all them reunite in the house to distribute the household goods: three sons of Marga, Casandra (a radio announcer) and her husband Gus, Héctor (a wealthy businessman) and his incoming wife Ana, and Aquilles ""Aki"" (an unsuccessful actor) who lives in the country house writing his autobiography. The reunion completes with Julia (disguised as Marga's assistant), Leo (an old famous actor with dementia and Marga's ex-husband, father of Casandra, Héctor and Aki), and María (Casandra and Gus' daughter), a teenager girl trying to overcome her early schizo. Meanwhile Marga tries to find the way to announce her relationship with Julia to her family, Julia tries to save her marriage after Gus discovered a love affair of her, Héctor and Ana face their wedding with a terrible secret that only they know, and Aki feels ...",Drama,Spain,Spanish,"EUR1,500,000","$102,428",2h 5min,Miguel del Arco,"Marta López Mazorra,Nuria García,Ángela Peral"
tt6284064,La fameuse invasion des ours en Sicile,2019.0,7.3,"1,059","Troubadour Gedeone and his young apprentice Almerina are two traveling entertainers who move from a town to another as storytellers to gain money. Surprised by a night blizzard in their last journey through the island of Sicile, they two enter into a mountain cave looking for refugee, learning that in the cave inhabits an aging bear. In an attempt to avoid to be attacked, Gedeone tells him a story about a king bear named Leonce who, playing in a river with his son Tonio, losses the prince when he's kidnapped by humans and taken far away from the forest. Neglecting his liabilities as king to care his clan during several months due by the affliction of the loss, finally he's concerned by his second hand Salpetre about the possibility that Tonio could be alive in the land of men. Leonce calls his clan to move there, but the evil Grand Duc is reported by old magician Theophile about bears' invasion and he sends Theophile to defeat them, failing in an attempts that include a wild boars ...","Adventure,Animation,Family","France,Italy","French,Italian","EUR11,000,000","$2,113,646",1h 22min,Lorenzo Mattotti,"Jean-Claude Carrière,Leïla Bekhti,Thomas Bidegain"
tt1707386,Les Misérables,2012.0,7.6,"306,585","Jean Valjean, known as Prisoner 24601, is released from prison and breaks parole to create a new life for himself while evading the grip of the persistent Inspector Javert. Set in post-revolutionary France, the story reaches resolution against the background of the June Rebellion.","Drama,History,Musical","UK,USA",English,"$61,000,000","$441,809,770",2h 38min,Tom Hooper,"Anne Hathaway,Hugh Jackman,Russell Crowe"
tt3849586,Asasiz Musa,2014.0,4.7,76,"Musa Anter's complicated life story told in several segments, each representing a different aspect of Anter.",Biography,Turkey,"Kurdish,Turkish","$20,000","$4,618",1h 20min,Aydin Orak,"Murat Toprak,Senay Aydin,Turgay Tanülkü"
tt0937378,Varg,2008.0,6.1,"1,203",An examination of how the traditions of the Sami villagers in northern Sweden is confronted with modern day society.,"Action,Adventure,Drama","Finland,Norway,Sweden","Saami,Swedish","EUR2,350,000","$1,448,891",1h 35min,Daniel Alfredson,"Peter Stormare,Robin Lundberg,Rolf Degerlund"
tt0848577,Colorado Avenue,2007.0,5.7,244,"In the early 1900s, emigrant Hanna returns from Colorado to Finland. In America she was known as Dollar-Hanna, but in Finland she has to endure the Civil War and live through the prohibition. Hanna's independent spirit will guide her.",Drama,"Finland,Sweden",Swedish,"EUR2,800,000","$596,580",2h,Claes Olsson,"Birthe Wingren,Nicke Lignell,Peter Kanerva"
tt2241351,Money Monster,2016.0,6.5,"93,618","In the real-time, high stakes thriller Money Monster, George Clooney and Julia Roberts star as financial TV host Lee Gates and his producer Patty, who are put in an extreme situation when an irate investor who has lost everything (Jack O'Connell) forcefully takes over their studio. During a tense standoff broadcast to millions on live TV, Lee and Patty must work furiously against the clock to unravel the mystery behind a conspiracy at the heart of today's fast-paced, high-tech global markets.","Crime,Drama,Thriller",USA,"English,Icelandic,Korean,Russian","$27,000,000","$93,282,604",1h 38min,Jodie Foster,"George Clooney,Jack O'Connell,Julia Roberts"
tt5096920,Dip sin dip sin,2015.0,4.2,136,"Min (Jacqueline Ch'ng), Lung (Sammy Sum), Keong and Fen are business partners of an online game design company, which is on the verge of winding up due to the lack of clients. Just as things start to get worse, a mysterious lady, Mrs. Wong (Paw Hee Ching) offers them a sizable sum of money if they could complete the final stages of her deceased son's online game - Ouija Board and launch it thereafter. They readily accept the business. Soon mysterious things happen and they experience ghost sightings.",Horror,Hong Kong,"Cantonese,Malay,Mandarin","HKD5,000,000","$680,791",1h 25min,Jill Wong,"Alan Chun-Kwong Luk,Jacqueline Chong,Sammy Sum"
tt0091557,The Mosquito Coast,1986.0,6.6,"26,290","An eccentric and dogmatic inventor sells his house and takes his family to Central America to build a utopia in the middle of the jungle. Conflicts with his family, a local preacher, and with nature are only small obstacles to his obsession. Based on the novel by Paul Theroux.","Adventure,Drama,Thriller",USA,"English,Spanish","$25,000,000","$14,302,779",1h 57min,Peter Weir,"Harrison Ford,Helen Mirren,River Phoenix"
tt8396228,Dubcek,2018.0,6.4,81,"This is the first film about well-reputed man of Czechoslovak and Slovak history - Alexander Dubcek - the leader of many important social changes during Sixties. Suddenly, on August 21st, 1968 the armies of five countries of Warsaw Pact invaded Czechoslovakia and buried the process of democratization for good.","Drama,History",Slovakia,Slovak,"EUR1,000,000","$64,841",1h 32min,Laco Halama,"Adrian Jastraban,Jakub Jánosík,Tána Radeva"
tt0495034,Golmaal: Fun Unlimited,2006.0,7.4,"14,987","Gopal, Lucky, Madhav and Laxman - four guys bound together by their child-like notoriety, aimlessness and petty business of conning people for fun and money. Laxman is an intelligent student who is not allowed to pass by his mischievous band of friends Gopal, Madhav and mute Lucky. This is because all four friends use his hostel room to conduct their activities. He is peer-pressured into running a series of scams in order to earn himself and his friends some money. Once thrown out of college bag-n-baggage, the naughty foursome finds refuge in the bungalow of a blind couple as their grandson. A cat mouse game unfolds as Laxman's body and Gopal's voice makes for Sameer (The grandson from US). Each time the blinded Dadaji comes amidst them, hilarious situations arise Enter Nirali with a bath towel and the group now have time, place and 'resources' to fall in love. Their individual efforts at winning the lady's heart, fail, resulting in rib tickling comic scenes. Apart from their amorous ...","Action,Comedy,Drama",India,Hindi,"INR150,000,000","$350,948",2h 30min,Rohit Shetty,"Ajay Devgn,Arshad Warsi,Sharman Joshi"
tt0478860,Embarque Imediato,2009.0,4.6,101,"Wagner is a 22 year old Brazilian guy, who dreams about leaving the Country for a better life, until he meets Justina, an experienced woman who turns his life upside down. Together they will discover that life has a lot more to offer.",Comedy,Brazil,"English,Portuguese,Spanish","$1,500,000","$177,627",1h 30min,Allan Fiterman,"Jonathan Haagensen,José Wilker,Marília Pêra"
tt0109676,Drop Zone,1994.0,5.6,"19,109",A team of skydiving crooks led by DEA-agent-turned-bad Busey specialize in landing on police roofs and breaking in so their evil computer nerd can steal undercover agents' files and sell them to drug lords. Federal Marshal Snipes lost a brother to this crew and learns skydiving with the help of tough-but-lovable instructor Butler so he can track them down. DIE HARD meets PASSENGER 57 meets CLIFFHANGER.,"Action,Adventure,Thriller",USA,English,"$45,000,000","$28,735,315",1h 41min,John Badham,"Gary Busey,Wesley Snipes,Yancy Butler"
tt3540136,Zhan lang,2015.0,5.4,"4,325",A Chinese special force soldier with extraordinary marksmanship is confronted by a group of deadly foreign mercenaries who are hired to assassinate him by a vicious drug lord.,"Action,Crime,Thriller",China,"English,Mandarin","$12,000,000","$81,411,331",1h 30min,Jing Wu,"Dahong Ni,Jing Wu,Nan Yu"
tt7968456,Kurukshetra,2019.0,6.9,987,"The film is loosely based on the Indian epic Mahabharata and poet Ranna's Gadhayuddha with the story centered upon Duryodhana, a Kaurava king.","History,War",India,"Hindi,Kannada,Malayalam,Tamil,Telugu","INR600,000,000","$7,320",3h 5min,Naganna,"Arjun Sarja,Darshan Thoogudeep,Meghana Raj"
tt5437194,30 svidaniy,2016.0,4.9,150,"Unlucky Dasha believes that it will help the online training - for a month visit the 30 dates, and then the man of her dreams will find her. Just to stay alive after a meeting with crazy cavalry and try to discern among them the perfect man.","Comedy,Romance",Russia,Russian,"$1,000,000","$1,563,249",1h 28min,Taisiya Igumentseva,"Dmitriy Bogdan,Natalya Medvedeva,Nikita Panfilov"
tt7232860,Xin li zui,2017.0,4.7,122,A top student of criminal psychology helps criminal police team to crack a serial murder case.,"Action,Crime,Drama",China,"Chinese,Mandarin","CNY100,000,000","$45,698,503",1h 50min,Dongshen Xie,"Jiaqi Feng,Kuo-Chu Chang,Tiantian Fan"
tt2016152,Balla con noi - Let's Dance,2011.0,4.7,20,"Rome. Erica is a dancer of the National Academy of Dance. The diploma examination is approaching and the voltage increases, out to show their utmost, but it is devolved, dance badly, fell and injured his ankle. The world seems to burying her. Marco is the soul of the Avengers, a multiethnic crew (Sara, Claudietto, Congo and Aziz) dancing hip hop, in continuous competition with the crew of Cico, the new boyfriend of his former Betty. Erica and Mark are brothers, but Marco has left home for choosing a lifestyle different. Erica's brother tries to find a little 'help in a time of crisis and knows that the Congo invites the challenge between the crew of Cico and that of his brother. He discovers a world totally unknown to her, but when he tries to deepen the relationship with Marco, the distance is still too much. In the meantime, between Congo and Erica was born a sincere sympathy. Marco understands that needs to change something in the way he put himself in front of the life decides to ...",Musical,Italy,Italian,EUR16,"$67,512",1h 42min,Cinzia Bomoll,"Alice Bellagamba,Andrea Montovoli,Mascia Musy"
tt2023473,En enkel till Antibes,2011.0,6.0,602,"When George (Sven-Bertil Taube), a half-blind widower, learns that his children (Malin Morgan, Dan Ekborg) have conceived an elaborate plan to get their hands on his assets before he dies, he must confront his life choices. After catching his young home help Maria (Rebecca Ferguson's screen debut) red-handed in the act of stealing, George blackmails her into assisting him in a counterattack, triggering off a chain reaction in the family. George's children discover that he has a secret mistress in France.",Drama,Sweden,Swedish,"SEK15,000,000","$1,491,653",1h 45min,Richard Hobert,"Dan Ekborg,Rebecca Ferguson,Sven-Bertil Taube"
tt5650098,Monkey,2016.0,6.8,321,Iva (17) and Maya (12) are half-sisters with a common father who they adore. The life of the sisters is turned upside down by a truly shocking event - their father Andrey (45) is in a coma after a routine operation.,Drama,Bulgaria,Bulgarian,"EUR800,000","$51,719",1h 35min,Dimitar Kotzev,"Aleksandra Kostova,Radina Borshosh,Valentin Ganev"
tt0418763,Jarhead,2005.0,7.0,"174,582","Anthony ""Swoff"" Swofford, a Camus-reading kid from Sacramento, enlists in the Marines in the late 1980s. He malingers during boot camp, but makes it through as a sniper, paired with the usually-reliable Troy. The Gulf War breaks out, and his unit goes to Saudi Arabia for Desert Shield. After 175 days of boredom, adrenaline, heat, worry about his girlfriend finding someone else, losing it and nearly killing a mate, demotion, latrine cleaning, faulty gas masks, and desert football, Desert Storm begins. In less than five days, it's over, but not before Swoff sees burned bodies, flaming oil derricks, an oil-drenched horse, and maybe a chance at killing. Where does all the testosterone go?","Action,Biography,Drama","Germany,UK,USA","Arabic,English,Latin,Spanish","$72,000,000","$97,076,152",2h 5min,Sam Mendes,"Jake Gyllenhaal,Jamie Foxx,Lucas Black"
tt0076451,"New York, New York",1977.0,6.7,"18,156","The day WWII ends, Jimmy, a selfish and smooth-talking musician, meets Francine, a lounge singer. From that moment on, their relationship grows into love as they struggle with their careers and aim for the top.","Drama,Music,Musical",USA,English,"$14,000,000","$16,400,000",2h 35min,Martin Scorsese,"Lionel Stander,Liza Minnelli,Robert De Niro"
tt0205177,Kevin & Perry Go Large,2000.0,5.6,"12,390","Kevin and Perry are two 15-year-old boys whose desperation to lose their virginity is so great that it inspires a sort of awe. In the rare moments when they're not thinking about girls, Kevin dreams of being a singer and Perry aspires to be a dance-music DJ. When they manage to stop a bank robbery, they're given a sizable cash reward and decide to go on holiday to Ibiza, which is supposedly populated with thousands of beautiful women willing to sleep with anyone. Bu after the boys pack plenty of condoms and sunscreen, Kevin's parents announce that they're tagging along. Undeterred, Kevin and Perry make the trip and meet superstar DJ Eyeball Paul , who may or may not listen to their demo tape. The boys also encounter Gemma and Candice, two scruffy teenage girls who are nearly as eager as Kevin and Perry to get horizontal.","Comedy,Music",UK,"English,Spanish","GBP2,000,000","$15,932",1h 22min,Ed Bye,"Harry Enfield,Kathy Burke,Rhys Ifans"
tt0290329,Bijitâ Q,2001.0,6.6,"15,013","A father, who is a failed former television reporter tries to mount a documentary about violence and sex among youths. He proceeds to have sex with his daughter who is now a prostitute and films his son being humiliated and hit by classmates. ""Q"", a perfect stranger somehow gets involved and enter the bizzare family who's son beats his mom, who in turn is also a prostitute and a heroin addict...","Comedy,Drama,Horror",Japan,Japanese,"JPY7,000,000","$15,678",1h 24min,Takashi Miike,"Kazushi Watanabe,Ken'ichi Endô,Shungiku Uchida"
tt0298203,8 Mile,2002.0,7.1,"247,912","The setting is Detroit in 1995. The city is divided by 8 Mile, a road that splits the town in half along racial lines. A young white rapper, Jimmy ""B-Rabbit"" Smith Jr. summons strength within himself to cross over these arbitrary boundaries to fulfill his dream of success in hip hop. With his pal Future and the three one third in place, all he has to do is not choke.","Drama,Music","Germany,USA",English,"$41,000,000","$242,875,078",1h 50min,Curtis Hanson,"Brittany Murphy,Eminem,Kim Basinger"
tt1097013,Next Day Air,2009.0,5.8,"10,163","When a misguided delivery driver inadvertently delivers a package containing concealed bricks of cocaine to the wrong address, it sets in motion a desperate search and battle for the coke between the furious dealer that sent it, the fearful intended recipients that missed it, and the conniving accidental recipients that plan to flip it. Time is running out and everyone's trying to get their hands on the package that's been sent...Next Day Air!","Action,Comedy,Crime",USA,"English,French","$3,000,000","$10,172,519",1h 24min,Benny Boom,"Donald Faison,Mike Epps,Yasiin Bey"
tt0061328,Accident,1967.0,6.9,"3,845","The Oxford Professor of Philosophy Stephen (Sir Dirk Bogarde) has two favorite pupils, the athletic aristocrat William (Michael York) and the Austrian Anna von Graz (Jacqueline Sassard). Stephen is a frustrated man, with a negligent wife, Rosalind (Vivien Merchant), who is pregnant of their third child, and is envious of the Oxford professor Charley (Stanley Baker), who has a television show. Stephen feels attracted to Anna, but William woos her and she becomes his girlfriend. Charley has a love affair with Anna, but when things go wrong, Anna must leave town.",Drama,UK,English,"$600,000","$64,675",1h 45min,Joseph Losey,"Dirk Bogarde,Jacqueline Sassard,Stanley Baker"
tt2978462,Dolphin Tale 2,2014.0,6.4,"8,303","It has been several years since young Sawyer Nelson and the dedicated team at the Clearwater Marine Hospital, headed by Dr. Clay Haskett, rescued Winter. With the help of Dr. Cameron McCarthy, who developed a unique prosthetic tail for the injured dolphin, they were able to save her life. Yet their fight is not over. Winter's surrogate mother, the very elderly dolphin Panama, has passed away, leaving Winter without the only poolmate she has ever known. However, the loss of Panama may have even greater repercussions for Winter, who, according to USDA regulations, cannot be housed alone, as dolphins' social behavior requires them to be paired with other dolphins. Time is running out to find a companion for her before the team at Clearwater loses their beloved Winter to another aquarium.","Drama,Family",USA,English,"$36,000,000","$57,824,533",1h 47min,Charles Martin Smith,"Ashley Judd,Morgan Freeman,Nathan Gamble"
tt0244709,Pavilion of Women,2001.0,5.9,954,"In 1938, Ailian is the forty years old wife of a wealthy man, Mr. Wu, who belongs to the traditional Wu Family in China. In order to get rid off her sexual obligations with her husband, Ailian gives Chiuming, a very young concubine to him. Andre is an American priest and doctor who takes care of an orphanage and becomes the tutor of her eighteen years old son Fengmo Wu. Father Andre starts giving classes to Fengmo, Ailian and Chiuming. Then, two forbidden loves will rise: between the priest and the first wife, and between the son and the concubine, having the invasion of China by the Japanese in a big picture.","Drama,Romance,War","China,USA","English,Mandarin","$5,000,000","$36,992",1h 56min,Ho Yim,"Luo Yan,Sau Sek,Willem Dafoe"
tt0119934,Without Limits,1998.0,7.2,"6,568","The film follows the life of famous 1970s runner Steve Prefontaine from his youth days in Oregon to the University of Oregon where he worked with the legendary coach Bill Bowerman, later to Olympics in Munich and his early death at 24 in a car crash.","Biography,Drama,Sport",USA,"English,Finnish,German","$25,000,000","$777,423",1h 57min,Robert Towne,"Billy Crudup,Donald Sutherland,Monica Potter"
tt0094118,Teen Wolf Too,1987.0,3.4,"10,550","After Scott Howard's hairy adventure in Teen Wolf (1985), his equally unpopular and unathletic cousin, Todd, receives a college boxing scholarship and gets accepted into Hamilton University. Before long, the family's lupine gene finally comes out, and just like that, the once-feeble student becomes a celebrity and the school's champion, catching the eye of the college's pretty girls. Now, there's no turning back, and success is guaranteed; however, being a teenage werewolf has its price. Will the famous and self-assured teen wolf see the error of his ways? Is Todd willing to accept responsibility for his actions, and put his superhuman power to good use?","Comedy,Fantasy",USA,English,"$3,000,000","$7,888,703",1h 35min,Christopher Leitch,"Jason Bateman,John Astin,Kim Darby"
tt0100507,Rocky V,1990.0,5.3,"126,072","Rocky Balboa is forced to retire after having permanent damage inflicted on him in the ring by the Russian boxer Ivan Drago. Returning home after the Drago bout, Balboa discovers that the fortune that he had acquired as heavyweight champ has been stolen and lost on the stockmarket by his accountant. His boxing days over, Rocky begins to coach an up-and-coming fighter named Tommy Gunn. Rocky cannot compete, however, with the high salaraies and glittering prizes being offered to Gunn by other managers in town.","Drama,Sport",USA,"English,Italian","$42,000,000","$119,946,358",1h 44min,John G. Avildsen,"Burt Young,Sylvester Stallone,Talia Shire"
