tconst,name,year,rating,rating_count,story_line,genres,country,language,budget,gross,runtime,director,stars
tt0439478,The Boynton Beach Bereavement Club,2005.0,6.4,939,"A romantic comedy about our amazing capacity to rebound and fall in love at any age. Lois, Harry, Marilyn ,Sandy and Jack live in an ""Active Adult"" community in Boynton Beach, Florida. Their lives intersect when they meet at a local Bereavement Club where they go to find emotional support after the loss of a loved one. For anyone who thinks that new love and romance ends long before retirement, they're in for a reality check. No one sees themselves as becoming old, and the residents of Boynton Beach aren't about to start. But sometimes we all need a little reminder that life is worth living and sharing.","Comedy,Romance",USA,English,"$1,500,000","$3,572,758",1h 45min,Susan Seidelman,"Brenda Vaccaro,Dyan Cannon,Joseph Bologna"
tt1085400,Estrellita,2007.0,6.4,131,"A widow grieves, discovers her deceased spouse's secret, and builds a relationship with a talented boy who used to play the violin with her husband in a local bar.","Drama,Music","Bosnia and Herzegovina,Germany,Republic of North Macedonia,Slovenia","Bosnian,Slovenian","EUR1,380,000","$69,043",1h 37min,Metod Pevec,"Marko Kovacevic,Senad Basic,Silva Cusin"
tt3797888,Kissebaaz,2019.0,4.6,190,"Set in Varanasi, the movie narrates a story of a man (played by Rahul Bagga), who is victim of a plot of a wily narrator.","Action,Comedy,Crime",India,Hindi,"INR55,000,000","$16,065",2h 2min,Annant Jaaitpaal,"Anupriya Goenka,Pankaj Tripathi,Rahul Bagga"
tt0365885,The Upside of Anger,2005.0,6.8,"21,120","A sharp-witted suburban wife, Terry Wolfmeyer, is left to raise her four headstrong daughters when her husband unexpectedly disappears. Things get even more hectic when she falls for her neighbor Denny, a once-great baseball star turned radio d.j. This leaves her daughters out on a limb. They are forced to juggle their mom's romantic dilemmas as well as their own.","Comedy,Drama","Germany,UK,USA",English,"$12,000,000","$28,237,488",1h 58min,Mike Binder,"Erika Christensen,Joan Allen,Kevin Costner"
tt5851680,Tuntematon mestari,2018.0,7.4,780,"An elderly art dealer Olavi (72) is about to retire. A man who has always put business and art before everything - even his family - cannot imagine life without work. At an auction, an old painting catches his attention. Olavi suspects it is worth much more than its starting price, which is low because its authenticity hasn't been confirmed. Olavi's instincts kick in. He decides to make one last deal in order to earn some proper pension money. At the same time, Olavi's daughter Lea (42) - whom he hasn't seen for years - asks him to help her with his teenage grandson Otto (15). Together with Otto, Olavi starts to investigate the background of the painting. They find out that the painting is called Christ and was painted by Ilya Repin. Olavi manages to buy the painting, but when the auction house realizes that there has been a mistake with the original pricing, they turn against him. To fulfill his dream, the old dealer must face both the auction house and his own past mistakes.",Drama,Finland,"Finnish,Swedish","EUR2,500,000","$101,247",1h 35min,Klaus Härö,"Amos Brotherus,Heikki Nousiainen,Pirjo Lonka"
tt0460791,The Fall,2006.0,7.9,"106,791","At a Los Angeles hospital in the 1920s, Alexandria is a child recovering from a broken arm. She befriends Roy Walker, a movie stunt man with legs paralyzed after a fall. At her request, Roy tells her an elaborate story about six men of widely varied backgrounds who are on a quest to kill a corrupt provincial governor. Between chapters of the story, Roy inveigles Alexandria to scout the hospital's pharmacy for morphine. As Roy's fantastic tale nears its end, Death seems close at hand.","Adventure,Drama,Fantasy","India,South Africa,USA","English,Latin,Romanian","$30,000,000","$3,669,465",1h 57min,Tarsem Singh,"Catinca Untaru,Justine Waddell,Lee Pace"
tt0443533,The History of Love,2016.0,6.3,"1,221",The story of a long-lost book that mysteriously reappears and connects an old man searching for his son with a girl seeking a cure for her mother's loneliness.,"Drama,Romance,War","Belgium,Canada,France,Romania","English,Yiddish","EUR15,000,000","$492,272",2h 14min,Radu Mihaileanu,"Derek Jacobi,Elliott Gould,Gemma Arterton"
tt5988370,Reis,2017.0,1.4,"72,278","A drama about the early life of Recep Tayyip Erdogan, the president of Turkey, focusing on his childhood in Istanbul, his political career as the mayor of Istanbul from 1994 to 1998, and his short imprisonment in 1999.","Biography,Drama",Turkey,Turkish,"$8,000,000","$538,551",1h 48min,Hüdaverdi Yavuz,"Orhan Aydin,Volkan Basaran,Özlem Balci"
tt3321428,Torrente 5: Operación Eurovegas,2014.0,5.4,"3,808",Crooked cop Torrente gets out of jail in the year 2018 to find a different Spain from the one he knew.,"Action,Comedy",Spain,Spanish,"EUR8,500,000","$13,851,074",1h 45min,Santiago Segura,"Jesulín de Ubrique,Julián López,Santiago Segura"
tt2053378,Juoppohullun päiväkirja,2012.0,4.3,"1,298","Juha Berg is a hopeless drunkard living in Helsinki. He is 30 years old and not the slightest intention to change his life in any way. But the joy of living always with alcohol-soaked brain will be threatened when Juha falls. Juha happy Berg is an alcoholic, a hopeless drunkard living in Kallio district of Helsinki. It has about thirty years and zero intentions to change something in his life. But the joy of living always with alcohol-soaked brain becomes seriously threatened when the passionate Juha falls in love with Tiina, the leader of his group of Alcoholics Anonymous. His relationship with Tiina progressing rapidly, and the man gets to balance maintaining this relationship with his old lifestyle. Of course there is anyone in this story that makes everything he can think of to sabotage the relationship of the two: it is a woman's best friend, Kristian.",Comedy,Finland,Finnish,"EUR1,312,000","$1,552,896",1h 24min,Lauri Maijala,"Joonas Saartamo,Krista Kosonen,Santtu Karvonen"
tt1134828,Kaméleon,2008.0,7.3,"2,103","While cleaning offices at night, George learns a lot about the employees by examining what they leave behind, carefully choosing his targets, always disillusioned women whom he seduces, methodically taking their money. An artist of manipulation, with a generous dose of humor and the ability to assume different personalities, George begins to work in a psychologist's practice, where he learns of Hanna, a 30 year-old dancer who was hurt in a car accident and the daughter of a millionaire. The ideal victim if love doesn't get in the way.","Comedy,Drama,Thriller",Hungary,"English,Hungarian,Spanish","$900,000","$676,111",1h 48min,Krisztina Goda,"Ervin Nagy,Gabriella Hámori,Zsolt Trill"
tt0382765,Jindabyne,2006.0,6.3,"6,395","Jindabyne, in the southeast section of New South Wales, was moved to its current site from its original site upon the building of a hydroelectric dam, the resulting reservoir, Lake Jindabyne, which now sits atop the original townsite. Among its residents are a group of friends who socialize together: married Stewart and Claire, a service station owner/former race car driver and a pharmacist respectively, and their adolescent son Tommy; married Carl and Jude, who have been guardians to their adolescent granddaughter Caylin-Calandria, Tommy's friend and disruptive classmate, ever since her mother's passing; Rocco and his new aborigine girlfriend, Carmel, a teacher at Tommy and Caylin-Calandria's school; and young parents Billy and Elissa, Billy who works casually as a mechanic for Stewart. Despite Stewart and Claire loving each other, there has long been disharmony in their household. Claire left for eighteen months following Tommy's birth due to post-partum depression. Then, Stewart's ...","Crime,Drama,Mystery",Australia,"Aboriginal,English,Irish","AUD15,000,000","$6,044,112",2h 3min,Ray Lawrence,"Gabriel Byrne,John Howard,Laura Linney"
tt0102926,The Silence of the Lambs,1991.0,8.6,"1,257,236","F.B.I. trainee Clarice Starling (Jodie Foster) works hard to advance her career, while trying to hide or put behind her West Virginia roots, of which if some knew, would automatically classify her as being backward or white trash. After graduation, she aspires to work in the agency's Behavioral Science Unit under the leadership of Jack Crawford (Scott Glenn). While she is still a trainee, Crawford asks her to question Dr. Hannibal Lecter (Sir Anthony Hopkins), a psychiatrist imprisoned, thus far, for eight years in maximum security isolation for being a serial killer who cannibalized his victims. Clarice is able to figure out the assignment is to pick Lecter's brains to help them solve another serial murder case, that of someone coined by the media as ""Buffalo Bill"" (Ted Levine), who has so far killed five victims, all located in the eastern U.S., all young women, who are slightly overweight (especially around the hips), all who were drowned in natural bodies of water, and all who ...","Crime,Drama,Thriller",USA,"English,Latin","$19,000,000","$272,742,922",1h 58min,Jonathan Demme,"Anthony Hopkins,Jodie Foster,Lawrence A. Bonney"
tt0111257,Speed,1994.0,7.2,"326,078","When a young Los Angeles police department, Special Weapons and Tactics (S.W.A.T.) officer called Jack Traven angers retired Atlanta police department bomb squad member Howard Payne, by foiling his attempt at taking hostages stuck in an elevator with a bomb, Payne in retaliation arms a bus with a bomb that will explode if it drops below 50 miles per hour. With the help of spunky passenger Annie, Jack and his partner Detective Harry Temple try to save the people on the bus before the bomb goes off, while also trying to figure out how Payne is monitoring them.","Action,Adventure,Thriller",USA,English,"$30,000,000","$350,448,145",1h 56min,Jan de Bont,"Dennis Hopper,Keanu Reeves,Sandra Bullock"
tt2062559,Invasor,2012.0,5.6,857,"After almost getting killed in a terrorist attack during an international mission, Pablo, a Spanish military doctor returns home to heal his wounds with his family. Soon Pablo starts suspecting that the army is withholding information about the attack and starts receiving pressure from the military high command to verify the official army version of the events. His refusal to comply and his search for the truth will endanger his life and his family.","Action,Adventure,Crime","France,Spain","Arabic,English,Spanish","EUR3,000,000","$676,451",1h 39min,Daniel Calparsoro,"Alberto Ammann,Antonio de la Torre,Karra Elejalde"
tt7744802,"Fala Sério, Mãe!",2017.0,6.1,510,"Ângela Cristina, mother of teenager Maria de Lourdes, has to deal with the difficulties and delights of guiding her daughter during one of the most complicated stages of life.","Comedy,Family",Brazil,Portuguese,"BRL6,000,000","$11,616,161",1h 19min,Pedro Vasconcelos,"Ingrid Guimarães,Larissa Manoela,Marcelo Laham"
tt0848228,The Avengers,2012.0,8.0,"1,252,485","Nick Fury is the director of S.H.I.E.L.D., an international peace-keeping agency. The agency is a who's who of Marvel Super Heroes, with Iron Man, The Incredible Hulk, Thor, Captain America, Hawkeye and Black Widow. When global security is threatened by Loki and his cohorts, Nick Fury and his team will need all their powers to save the world from disaster which is formed by Loki and his team","Action,Adventure,Sci-Fi",USA,"English,Hindi,Russian","$220,000,000","$1,518,815,515",2h 23min,Joss Whedon,"Chris Evans,Robert Downey Jr.,Scarlett Johansson"
tt0099371,Days of Thunder,1990.0,6.1,"78,642","Cole Trickle enters the high-pressure world of Nascar racing. He's a hot driver with a hot temper, and this attitude gets him into trouble not only with other drivers, but members of his own team as well.","Action,Drama,Sport",USA,"English,French","$60,000,000","$157,920,733",1h 47min,Tony Scott,"Nicole Kidman,Robert Duvall,Tom Cruise"
tt0072226,The Sugarland Express,1974.0,6.8,"15,316","Lou-Jean, a blonde woman, tells her husband, who is imprisoned, to escape. They plan to kidnap their own child, who was placed with foster parents. The escape is partly successful, they take a hostage, who is a policeman and are pursued through to Texas...","Crime,Drama",USA,English,"$3,000,000","$7,504,841",1h 50min,Steven Spielberg,"Ben Johnson,Goldie Hawn,Michael Sacks"
tt0220827,Non ho sonno,2001.0,6.2,"6,344",A retired detective with insomnia is called upon to solve a series of murders. His partner is a fresh faced rookie who has the aid of the latest technological equipment to help solve the crimes. Will they catch the killer?,"Horror,Mystery,Thriller",Italy,"English,Italian","$4,000,000","$158,811",1h 57min,Dario Argento,"Chiara Caselli,Max von Sydow,Stefano Dionisi"
tt0123209,The Other Sister,1999.0,6.5,"11,757","When Carla Tate, now a young woman, is 'graduated' out of the training school where she has resided for many years because she is mentally challenged, her hope is that she will be accepted for all that she can now do for herself. But Carla's family is wealthy which permits her mother, already blinded to her daughter's rather high-functioning abilities, to try and provide for Carla beyond her needs or desires, bringing forth the inevitable confrontations... for what Carla may lack in mental ability she certainly makes up for in her insistence on being independent, even to living in her own apartment. But if this isn't enough, into the mix comes a young man, equally challenged mentally, who moves Carla beyond anyone's control...","Comedy,Drama,Romance",USA,English,"$35,000,000","$27,807,627",2h 9min,Garry Marshall,"Diane Keaton,Giovanni Ribisi,Juliette Lewis"
tt0082869,Outland,1981.0,6.6,"27,150","Marshal O'Niel's assigned to a mining colony on Io, one of Jupiter's moons. He soon encounters miners who are dying, due to use of an illegal amphetamine. O'Niel follows the trail, and now O'Niel must watch his back, as he's now their target.","Action,Crime,Sci-Fi",UK,English,"$16,000,000","$17,374,595",1h 49min,Peter Hyams,"Frances Sternhagen,Peter Boyle,Sean Connery"
tt0108525,Wayne's World 2,1993.0,6.2,"76,704","Wayne is back, this time trying to organize a rock festival with help from friend Garth and the spirit of Jim Morrison (Doors). Meanwhile, his girlfriend's manager is busy trying to woo her away from Wayne and move her to LA. Life gets interesting when Wayne must rush from the concert to try and stop the wedding. Aerosmith are featured at the concert.","Comedy,Music",USA,"Cantonese,English","$40,000,000","$48,198,019",1h 35min,Stephen Surjik,"Christopher Walken,Dana Carvey,Mike Myers"
tt1529572,Trust,2010.0,6.9,"41,073","In Chicago, the fourteen-year-old Annie lives with her family in the suburb and she has been chatting in a teen chat room in Internet with the sixteen year-old Charlie. When they get close to each other, Charlie tells that he is actually twenty years old. They schedule to meet each other but when Annie meets Charlie, she realizes that he is about thirty-five years old and is disappointed. However, she is seduced by Charlie and loses her virginity to her ""boyfriend"" in a motel. Her best friend Brittany tells to the school counselor about the relationship of Annie with an older man and the teenager is sent to medical examination. Her parents Will and Lynn are visited by the FBI Agent Doug Tate that is in charge of the investigation. The family is torn apart and while Lynn supports her daughter, Will becomes obsessed to find the sexual predator.","Crime,Drama,Thriller",USA,English,"$4,000,000","$595,802",1h 46min,David Schwimmer,"Catherine Keener,Clive Owen,Liana Liberato"
tt1483324,At Middleton,2013.0,6.5,"7,854",Two parents fall in love over the course of a single day while playing hooky from their children's college tour.,"Comedy,Romance",USA,English,"$2,500,000","$82,993",1h 39min,Adam Rodgers,"Andy Garcia,Taissa Farmiga,Vera Farmiga"
tt0109758,Exit to Eden,1994.0,4.3,"6,464","Elliot is going to the island of Eden to live out his submissive fantasies, but inadvertently photographs diamond smugglers at work. Smugglers, and detectives, follow him to the island, where they try to retrieve the film. Elliot begins falling in love with Lisa, the head mistress of the island, and Lisa must evaluate her feelings about Elliot and her own motivations.","Comedy,Crime,Romance",USA,English,"$25,000,000","$6,841,570",1h 53min,Garry Marshall,"Dan Aykroyd,Dana Delany,Rosie O'Donnell"
tt0464913,"OSS 117: Le Caire, nid d'espions",2006.0,7.1,"18,401","An homage to classic spy films. It's 1955 and after a fellow agent and close friend disappears, secret agent Hubert Bonisseur de la Bath, a.k.a. OSS 117, is ordered to take his place at the head of a poultry firm in Cairo. This is to be his cover while he is busy investigating, foiling Nazi holdouts, quelling a fundamentalist rebellion, and bedding local beauties.","Action,Adventure,Comedy",France,"Arabic,French,German","EUR14,000,000","$23,041,621",1h 39min,Michel Hazanavicius,"François Damiens,Jean Dujardin,Khalid Maadour"
tt1296898,Waiting for Forever,2010.0,6.0,"19,557","Since his parents died in a train crash, Will Donner refused to grow up and became an unemployed drifter, aimless except for one obsession: his undeclared love for neighborhood girl Emma Twist, whom he stalked at a distance throughout the country. When she, now an actress, returns to their home town for her terminally ill, grossly cynical father, Will stays with his unsympathetic, conventional brother Jim, whose wife and kid adore the free-spirited silly uncle, whom neighboring friend Joe and his family cheerfully put up. Now it's time to face Emma.","Comedy,Drama,Romance",USA,English,"$5,000,000","$25,517",1h 35min,James Keach,"Rachel Bilson,Richard Jenkins,Tom Sturridge"
tt0206314,Joy Ride,2001.0,6.6,"63,744","College student Lewis decides to drive across the country to see Venna, a friend who doesn't know that Lewis is interested in her romantically. Unfortunately for his plans, Lewis gets saddled with his raucous-spirited older brother, Fuller, whose on-the-road pranks get the brothers and Venna sucked into a nightmare when a psychotic truckdriver takes offense.","Action,Mystery,Thriller",USA,English,"$23,000,000","$36,642,838",1h 37min,John Dahl,"Leelee Sobieski,Paul Walker,Steve Zahn"
tt2421230,Aikuisten poika,2014.0,5.6,163,"A tragicomedy about an 11-year old boy whose parents die in a car accident. The boy refuses to mourn; instead, he develops an obsession of investigating the accident. Oliver gets to know a peculiar man - a vagabond - who knows something about the accident. A reluctant friendship develops between the boy and the man. All the well-kept secrets of the man are revealed while the boy is forced to face the facts and the emotions caused by his parents' death.","Comedy,Drama",Finland,Finnish,"EUR1,200,000","$87,072",1h 34min,Juha Lehtola,"Esa Nikkilä,Kari Hietalahti,Susanna Haavisto"
tt4196776,Jason Bourne,2016.0,6.6,"206,674","Jason Bourne is again being hunted by the CIA. It begins when Nicky Parsons a former CIA operative who helped Bourne, who went under and now works with a man who's a whistle blower and is out to expose the CIA's black ops. Nicky hacks into the CIA and downloads everything on all their Black Ops, including Treadstone which Bourne was a part of. And Heather Lee, a CIA agent, discovers the hack and brings it to the attention of CIA Director Dewey, the man behind the Black Ops. He orders Parsons be found and, hopefully, Bourne, too.","Action,Thriller","China,USA","English,German,Greek,Japanese","$120,000,000","$415,484,914",2h 3min,Paul Greengrass,"Alicia Vikander,Matt Damon,Tommy Lee Jones"
tt0074958,Network,1976.0,8.1,"143,898","In the 1970s, terrorist violence is the stuff of networks' nightly news programming and the corporate structure of the UBS Television Network is changing. Meanwhile, Howard Beale, the aging UBS news anchor, has lost his once strong ratings share and so the network fires him. Beale reacts in an unexpected way. We then see how this affects the fortunes of Beale, his coworkers (Max Schumacher and Diana Christensen), and the network.",Drama,USA,English,"$3,800,000","$23,690,757",2h 1min,Sidney Lumet,"Faye Dunaway,Peter Finch,William Holden"
tt0172156,Bad Boys II,2003.0,6.6,"230,048","Miami is being flooded with ecstasy that's coming from Cuba through drug lord Johnny Tapia. Detectives Mike Lowrey and Marcus Burnett are on the case, and are determined to bring the man to justice. Additional drama is provided by friction with the DEA, which counts Marcus' younger sister Sydney among its agents, and from Marcus possibly transferring out of the department, leaving Mike without his longtime partner.","Action,Comedy,Crime",USA,"English,Russian,Spanish","$130,000,000","$273,339,556",2h 27min,Michael Bay,"Gabrielle Union,Martin Lawrence,Will Smith"
tt0137523,Fight Club,1999.0,8.8,"1,836,256","A nameless first person narrator (Edward Norton) attends support groups in attempt to subdue his emotional state and relieve his insomniac state. When he meets Marla (Helena Bonham Carter), another fake attendee of support groups, his life seems to become a little more bearable. However when he associates himself with Tyler (Brad Pitt) he is dragged into an underground fight club and soap making scheme. Together the two men spiral out of control and engage in competitive rivalry for love and power. When the narrator is exposed to the hidden agenda of Tyler's fight club, he must accept the awful truth that Tyler may not be who he says he is.",Drama,"Germany,Italy,USA",English,"$63,000,000","$101,209,593",2h 19min,David Fincher,"Brad Pitt,Edward Norton,Meat Loaf"
tt3352390,Friend Request,2016.0,5.3,"24,178","Popular college student Laura (Alycia Debnam-Carey) has tons of friends, both on Facebook and IRL. She graciously accepts social outcast Marina's (Liesl Ahlers) online friend request, until Marina crosses the line and Laura unfriends her. To everyone's shock, Marina takes her own life in a ritual meant to torment Laura, which appears in a video posted on Laura's profile. Even though it wasn't Laura who posted the video, or other creepy content that begins appearing on her page, her Facebook friend count begins to dwindle as a result. When her real-life friends start dying mysterious, cruel deaths, Laura must figure out how to break the deadly curse before it's too late.","Horror,Mystery,Thriller",Germany,English,"$9,900,000","$10,975,390",1h 32min,Simon Verhoeven,"Alycia Debnam-Carey,Connor Paolo,William Moseley"
tt0111742,Wolf,1994.0,6.2,"52,344","Worn down and out of luck, aging publisher Will Randall (Jack Nicholson) is at the end of his rope when a younger co-worker snatches his job out from under his nose. But after being bitten by a wolf, Will suddenly finds himself energized, more competitive than ever, and possessed with amazingly heightened senses. Meanwhile, the beautiful daughter of his shrewd boss begins to fall for him - without realizing that the man she's begun to love is gradually turning into the creature by which he was bitten.","Drama,Horror,Romance",USA,"English,Spanish","$70,000,000","$131,002,597",2h 5min,Mike Nichols,"Jack Nicholson,James Spader,Michelle Pfeiffer"
tt0414413,La promesa,2004.0,6.0,218,"After killing her abusive and unfaithful husband, the religious and schizophrenic housewife Gregoria leaves Madrid and travels to Galicia to visit a church where a stranger told her that everyone should go, dead or alive. When Gregoria arrives, she saves the life of the boy Daniel and his mother Dorita in gratitude invites her to have lunch at her house. Gregoria changes her name to Celia and accepts to work as nanny and chambermaid for Dorita and her dysfunctional husband Leandro. The violent behavior of Leandro triggers an insanity process in the delusional Celia, who is haunted by demons and ghosts while trying to protect Daniel from the evilness of his parents.","Horror,Thriller",Spain,Spanish,"EUR2,000,000","$169,993",1h 44min,Héctor Carré,"Ana Fernández,Carmen Maura,Juan Margallo"
tt2950418,Greater,2016.0,7.3,"4,485","Brandon Burlsworth is perhaps the greatest walk-on in the history of college football. Brandon had always dreamed of playing for the Arkansas Razorbacks, but was considered too short and too fat to play Division I. Undeterred, Brandon took a big risk and walked on in 1994. Written off by fellow teammates and coaches, Brandon displayed dogged determination in the face of staggering odds. An extremely devoted Christian, Brandon never cursed or drank. He was genuinely humble and low-key. He worked harder than anybody, on and off the field, becoming the first Razorback to earn a Bachelor's and Master's degree while still playing. The overly-fat kid who was once an embarrassment to his teammates and an annoyance to his coaches, ended up becoming the most respected player in the history of the program, changing the lives of all he touched. Eleven days after being drafted into the NFL, Brandon was tragically killed in a car accident, crushing all who knew him. Brandon was ""too good to be ...","Biography,Family,Sport",USA,English,"$9,000,000","$2,000,620",2h 10min,David L. Hunt,"Christopher Severio,Leslie Easterbrook,Neal McDonough"
